source,category,qid,type,question,optionA,optionB,optionC,optionD,optionE,optionF,correct,feedback,tags
hlthcr,4. Healthcare Data and Privacy,Q-DAT-028,tf,Patients typically pay less when they receive care from an out-of-network provider compared to an in-network provider.,,,,,,,False,"Out-of-network providers do not have pre-negotiated rates with the insurer, so patients typically pay significantly more.",
hlthcr,4. Healthcare Data and Privacy,Q-DAT-029,tf,One benefit of Electronic Health Records is reducing the duplication of tests for patients.,,,,,,,True,EHRs help reduce duplication of tests by making health information available electronically to authorized providers.,
hlthcr,4. Healthcare Data and Privacy,Q-DAT-030,tf,HCPCS Level II codes are the same as CPT codes.,,,,,,,False,"HCPCS Level I consists of CPT codes, not Level II. Level II covers products, supplies, and services not included in CPT.",
hlthcr,4. Healthcare Data and Privacy,Q-DAT-031,tf,A business associate may handle PHI on behalf of a covered entity without any written agreement as long as both parties verbally agree.,,,,,,,False,A business associate must sign a written Business Associate Agreement before handling PHI on behalf of a covered entity.,
hlthcr,4. Healthcare Data and Privacy,Q-DAT-032,tf,"The HIPAA Security Rule requires covered entities and business associates to ensure the confidentiality, integrity, and availability of ePHI.",,,,,,,True,"The Security Rule establishes national standards to protect ePHI, requiring confidentiality, integrity, and availability.",
hlthcr,4. Healthcare Data and Privacy,Q-DAT-033,tf,Certified EHR technology stores patient data in an unstructured format that requires manual sorting by providers.,,,,,,,False,"Certified EHR technology stores patient data in a structured format that allows easy retrieval, transfer, and use.",
hlthcr,4. Healthcare Data and Privacy,Q-DAT-034,tf,"The transition from ICD-9 to ICD-10 expanded the number of available diagnosis codes from approximately 14,000 to approximately 69,000.",,,,,,,True,"The ICD-10 transition dramatically increased the number of available diagnosis codes from roughly 14,000 to roughly 69,000.",
hlthcr,4. Healthcare Data and Privacy,Q-DAT-035,mc,Which of the following categories of information does PHI relate to?,"A person's health condition, health care provision, or payment for health care",A person's employment history and salary information,A person's educational background and academic records,A person's criminal record and court proceedings,,,A,"PHI relates to a person's past, present, or future health, the provision of health care, or payment for health care.",
hlthcr,4. Healthcare Data and Privacy,Q-DAT-036,mc,Which of the following is NOT typically considered a common PHI identifier?,Patient's name,Patient's blood type when not linked to any identifying information,Patient's Social Security Number linked to health data,Patient's home address linked to health data,,,B,"A blood type by itself, with no link to an individual's identity, is not PHI. PHI requires both health data and an identifier.",
hlthcr,4. Healthcare Data and Privacy,Q-DAT-037,mc,PHI is protected under HIPAA in which of the following forms?,Electronic only,Electronic and paper only,"Electronic, paper, and oral",Paper and oral only,,,C,"HIPAA protects PHI regardless of its form — electronic, paper, or oral.",
hlthcr,4. Healthcare Data and Privacy,Q-DAT-038,mc,The HIPAA Privacy Rule applies to which of the following?,Only hospitals and physician offices,Covered entities and their business associates,Only health insurance companies,Only federal government health programs,,,B,The Privacy Rule establishes standards for covered entities and their business associates regarding the protection of PHI.,
hlthcr,4. Healthcare Data and Privacy,Q-DAT-039,mc,What is the purpose of the minimum necessary standard?,To require the smallest possible electronic file size for health records,To limit PHI use and disclosure to the minimum amount needed for the intended purpose,To ensure that only the minimum number of staff members have access to medical equipment,To set the minimum number of patient visits required before PHI can be created,,,B,The minimum necessary standard requires covered entities to limit PHI use and disclosure to the minimum needed for the intended purpose.,
hlthcr,4. Healthcare Data and Privacy,Q-DAT-040,mc,Which type of PHI disclosure is exempt from the minimum necessary requirement?,Disclosures for health plan marketing campaigns,Disclosures for treatment purposes between health care providers,Disclosures to law enforcement for non-urgent inquiries,Disclosures to employers for workplace wellness programs,,,B,Treatment-related disclosures between health care providers are specifically exempt from the minimum necessary standard.,
hlthcr,4. Healthcare Data and Privacy,Q-DAT-041,mc,"Under the HIPAA Privacy Rule, which right do patients have regarding their PHI?",The right to delete any information from the provider's records permanently,"The right to access, inspect, and obtain a copy of their PHI",The right to prevent any provider from viewing their PHI,The right to edit their medical records directly without provider involvement,,,B,"The Privacy Rule grants individuals the right to access, inspect, and obtain a copy of their own PHI.",
hlthcr,4. Healthcare Data and Privacy,Q-DAT-042,mc,Which of the following qualifies as a HIPAA covered entity?,A health care provider who transmits health information electronically in connection with covered transactions,A medical device manufacturer that sells equipment to hospitals,A pharmaceutical company that develops prescription drugs,A health and wellness blog that publishes medical advice,,,A,Health care providers who transmit health information electronically in connection with covered transactions are one of the three types of covered entities.,
hlthcr,4. Healthcare Data and Privacy,Q-DAT-043,mc,What distinguishes a health care clearinghouse from other covered entities?,It provides direct patient care in a clinical setting,It processes health information received from another entity into a standard format,It sells health insurance policies to individuals,It manufactures medical equipment for hospitals,,,B,Health care clearinghouses process health information received from one entity into a standard format for another entity.,
hlthcr,4. Healthcare Data and Privacy,Q-DAT-044,mc,What must a business associate sign before handling PHI on behalf of a covered entity?,A patient consent form,A written Business Associate Agreement,A state medical license application,A provider enrollment form,,,B,A business associate must sign a written Business Associate Agreement (BAA) to comply with HIPAA rules before handling PHI.,
hlthcr,4. Healthcare Data and Privacy,Q-DAT-045,mc,Which of the following is an example of a business associate?,A patient receiving treatment at a hospital,A billing company that processes claims containing PHI for a physician's office,A nurse providing direct care to a patient in a hospital,A health insurer paying claims to a provider,,,B,A billing company that handles PHI on behalf of a covered entity is a business associate and must have a BAA in place.,
hlthcr,4. Healthcare Data and Privacy,Q-DAT-046,mc,The HIPAA Security Rule specifically protects which type of information?,All patient information in any form,Electronic protected health information (ePHI),Only paper-based medical records,Only oral communications between providers,,,B,The Security Rule specifically addresses the protection of electronic protected health information (ePHI).,
hlthcr,4. Healthcare Data and Privacy,Q-DAT-047,mc,Which of the following is one of the three core objectives the HIPAA Security Rule aims to ensure for ePHI?,Profitability,Availability,Portability,Marketability,,,B,"The Security Rule requires ensuring the confidentiality, integrity, and availability of ePHI.",
hlthcr,4. Healthcare Data and Privacy,Q-DAT-048,mc,Which of the following is an example of an administrative safeguard under the HIPAA Security Rule?,Installing locks on server room doors,Implementing workforce training policies on handling ePHI,Using encryption software to protect data in transit,Placing fire extinguishers near data storage equipment,,,B,Administrative safeguards include policies and procedures such as workforce training on handling ePHI.,
hlthcr,4. Healthcare Data and Privacy,Q-DAT-049,mc,Which of the following is an example of a technical safeguard under the HIPAA Security Rule?,Conducting background checks on employees,Storing backup tapes in a locked offsite location,Implementing access controls that require unique user IDs and passwords,Training staff on privacy policies,,,C,"Technical safeguards are technology-based controls such as access controls, user authentication, and encryption.",
hlthcr,4. Healthcare Data and Privacy,Q-DAT-050,mc,"Under the Breach Notification Rule, what is the maximum number of days a covered entity has to notify affected individuals after discovering a breach of unsecured PHI?",30 days,45 days,60 days,90 days,,,C,The Breach Notification Rule requires notification without unreasonable delay and no later than 60 days after discovery.,
hlthcr,4. Healthcare Data and Privacy,Q-DAT-051,mc,What triggers the requirement for a covered entity to notify prominent media outlets about a breach?,Any breach affecting at least one individual,A breach affecting 500 or more residents of a state or jurisdiction,A breach involving electronic records only,A breach that occurs at a federal government facility,,,B,Media notification is required when a breach affects 500 or more residents of a single state or jurisdiction.,
hlthcr,4. Healthcare Data and Privacy,Q-DAT-052,mc,How are breaches of unsecured PHI affecting fewer than 500 individuals reported to HHS?,They do not need to be reported to HHS,They must be reported within 60 days of discovery,They are submitted to HHS annually,They are reported to state authorities instead of HHS,,,C,Smaller breaches affecting fewer than 500 individuals are reported to HHS on an annual basis.,
hlthcr,4. Healthcare Data and Privacy,Q-DAT-053,mc,What does the abbreviation ICD stand for?,Integrated Clinical Database,International Classification of Diseases,Internal Code for Diagnoses,Insurance Claims Documentation,,,B,"ICD stands for International Classification of Diseases, the standardized system for coding diagnoses.",
hlthcr,4. Healthcare Data and Privacy,Q-DAT-054,mc,ICD codes are primarily used to represent which of the following on claims and medical records?,Provider credentials and specialties,Medical diagnoses and inpatient procedures,Insurance premium amounts,Prescription drug dosages,,,B,ICD codes are standardized codes used to represent medical diagnoses and inpatient procedures on claims and records.,
hlthcr,4. Healthcare Data and Privacy,Q-DAT-055,mc,On what date did the United States transition from ICD-9 to ICD-10?,"January 1, 2010","October 1, 2015","July 1, 2013","March 1, 2018",,,B,"The U.S. transitioned from ICD-9 to ICD-10 on October 1, 2015.",
hlthcr,4. Healthcare Data and Privacy,Q-DAT-056,mc,"Approximately how many diagnosis codes does ICD-10 contain, compared to ICD-9?","ICD-9 had 69,000; ICD-10 has 14,000","ICD-9 had 14,000; ICD-10 has 69,000","ICD-9 had 5,000; ICD-10 has 25,000","ICD-9 had 30,000; ICD-10 has 100,000",,,B,"ICD-9 had approximately 14,000 diagnosis codes; ICD-10 expanded this to approximately 69,000.",
hlthcr,4. Healthcare Data and Privacy,Q-DAT-057,mc,Which coding system is used specifically for inpatient hospital procedures?,ICD-10-CM,ICD-10-PCS,CPT,HCPCS Level II,,,B,ICD-10-PCS (Procedure Coding System) is used specifically for coding inpatient hospital procedures.,
hlthcr,4. Healthcare Data and Privacy,Q-DAT-058,mc,What does the abbreviation CM stand for in ICD-10-CM?,Comprehensive Medicine,Clinical Modification,Claims Management,Certified Medical,,,B,CM stands for Clinical Modification. ICD-10-CM codes are used by all providers to code diagnoses.,
hlthcr,4. Healthcare Data and Privacy,Q-DAT-059,mc,What is the maximum character length of an ICD-10 code?,3 characters,5 characters,7 characters,10 characters,,,C,"ICD-10 codes can be up to 7 characters long, providing detail about location, severity, and type of condition.",
hlthcr,4. Healthcare Data and Privacy,Q-DAT-060,mc,What advantage does the longer character length of ICD-10 codes provide over ICD-9?,Faster claims processing speed,"More detail about the location, severity, and type of a condition",Lower insurance premiums for patients,Fewer codes for providers to memorize,,,B,"The expanded character length of ICD-10 allows more clinical detail about location, severity, and type of condition.",
hlthcr,4. Healthcare Data and Privacy,Q-DAT-061,mc,HCPCS is a standardized coding system with how many levels?,One,Two,Three,Four,,,B,"HCPCS has two levels — Level I (CPT codes) and Level II (products, supplies, and services not included in CPT).",
hlthcr,4. Healthcare Data and Privacy,Q-DAT-062,mc,What does HCPCS Level II cover that is not included in CPT?,Surgical procedures performed in hospitals,"Products, supplies, and services such as ambulance rides and durable medical equipment",Mental health diagnosis codes,Laboratory test result interpretations,,,B,"HCPCS Level II covers products, supplies, and services not included in CPT, such as ambulance services and durable medical equipment.",
hlthcr,4. Healthcare Data and Privacy,Q-DAT-063,mc,How many digits does a CPT code contain?,3 digits,4 digits,5 digits,7 digits,,,C,CPT codes are 5-digit numeric codes that identify medical services and procedures.,
hlthcr,4. Healthcare Data and Privacy,Q-DAT-064,mc,What organization maintains and publishes CPT codes?,Centers for Medicare and Medicaid Services (CMS),World Health Organization (WHO),American Medical Association (AMA),Department of Health and Human Services (HHS),,,C,The American Medical Association (AMA) develops and maintains CPT codes.,
hlthcr,4. Healthcare Data and Privacy,Q-DAT-065,mc,What is the format of a HCPCS Level II code?,5 numeric digits,One alphabetical letter followed by 4 numeric digits,7 alphanumeric characters,Two letters followed by 3 numeric digits,,,B,HCPCS Level II codes consist of one alphabetical letter followed by 4 numeric digits.,
hlthcr,4. Healthcare Data and Privacy,Q-DAT-066,mc,Who maintains HCPCS Level II codes?,The American Medical Association (AMA),The World Health Organization (WHO),The Centers for Medicare and Medicaid Services (CMS),The American Hospital Association (AHA),,,C,"CMS maintains HCPCS Level II codes to identify items such as ambulance services, durable medical equipment, and prosthetics.",
hlthcr,4. Healthcare Data and Privacy,Q-DAT-067,mc,Which of the following items would most likely be coded using a HCPCS Level II code?,An office visit with a primary care physician,A wheelchair provided to a patient as durable medical equipment,A diagnosis of type 2 diabetes,An outpatient knee surgery,,,B,"HCPCS Level II codes identify items like durable medical equipment, ambulance services, and prosthetics.",
hlthcr,4. Healthcare Data and Privacy,Q-DAT-068,mc,What is the primary financial benefit to patients of using an in-network provider?,The provider waives all fees for insured patients,"The provider charges pre-negotiated rates, resulting in lower out-of-pocket costs",The patient receives a tax credit for each in-network visit,The patient's deductible is automatically waived,,,B,"In-network providers have pre-negotiated rates with the insurer, which results in lower out-of-pocket costs for patients.",
hlthcr,4. Healthcare Data and Privacy,Q-DAT-069,mc,Why do patients typically pay more when using an out-of-network provider?,Out-of-network providers charge higher taxes on their services,"The provider does not have a contract with the insurer, so there are no pre-negotiated rates",Out-of-network providers use more expensive medical equipment,The patient's insurance policy is cancelled when they go out of network,,,B,"Without a contract, the provider is not bound to pre-negotiated rates, so the patient bears higher costs.",
hlthcr,4. Healthcare Data and Privacy,Q-DAT-070,mc,"What does it mean for a provider to be ""in-network""?",The provider is located within the same state as the patient,The provider has a contract with the patient's health insurer to provide services at agreed-upon rates,The provider accepts only Medicare patients,The provider works exclusively in a hospital setting,,,B,An in-network provider has a contract with the patient's health insurer to provide services at pre-negotiated rates.,
hlthcr,4. Healthcare Data and Privacy,Q-DAT-071,mc,Which of the following is typically included in an Electronic Health Record (EHR)?,A patient's credit score and financial history,"Demographics, medications, vital signs, and lab results",The provider's malpractice insurance details,The hospital's annual revenue reports,,,B,"EHRs include clinical data such as demographics, medications, vital signs, immunizations, lab results, and radiology reports.",
hlthcr,4. Healthcare Data and Privacy,Q-DAT-072,mc,How do EHRs help improve the quality of patient care?,By eliminating the need for physicians entirely,"By reducing duplication of tests, decreasing treatment delays, and improving record accuracy",By allowing patients to diagnose their own conditions,By replacing all in-person visits with telehealth sessions,,,B,"EHRs reduce test duplication, decrease delays, and improve accuracy by making information available electronically to authorized providers.",
hlthcr,4. Healthcare Data and Privacy,Q-DAT-073,mc,What is a key characteristic of certified EHR technology?,It stores data in handwritten format for authenticity,"It stores patient data in a structured format for easy retrieval, transfer, and use",It restricts data access to a single provider at a time,It requires data to be printed on paper before it can be shared,,,B,"Certified EHR technology stores data in a structured format that supports retrieval, transfer, and care decisions.",
hlthcr,4. Healthcare Data and Privacy,Q-DAT-074,mc,What type of standards does the HIPAA Privacy Rule establish?,Local hospital guidelines for visitor policies,National standards for protecting individually identifiable health information,International guidelines for pharmaceutical manufacturing,State-level regulations for medical school accreditation,,,B,The Privacy Rule establishes national standards for the protection of individually identifiable health information.,
hlthcr,4. Healthcare Data and Privacy,Q-DAT-075,mc,Which of the following is an example of a physical safeguard under the HIPAA Security Rule?,Assigning unique login credentials to each employee,Conducting annual risk assessments,Controlling physical access to facilities where ePHI is stored,Encrypting emails that contain patient data,,,C,"Physical safeguards protect the physical facilities, workstations, and devices where ePHI is stored or accessed.",
hlthcr,4. Healthcare Data and Privacy,Q-DAT-076,mc,The HIPAA Breach Notification Rule requires covered entities to notify affected individuals within what timeframe?,Immediately upon suspecting a breach,Within 24 hours of discovering a breach,Without unreasonable delay and no later than 60 days after discovery,Within one calendar year of the breach,,,C,The rule requires notification without unreasonable delay and no later than 60 days after discovering the breach.,
hlthcr,4. Healthcare Data and Privacy,Q-DAT-077,mc,How does an EHR differ from a traditional paper chart?,An EHR is a digital version of a patient's medical history maintained over time,An EHR contains less information than a paper chart,"An EHR can only be accessed by the patient, not the provider",An EHR must be printed and filed in a cabinet to be valid,,,A,"An EHR is a digital version of a patient's medical history maintained by the provider over time, unlike a paper chart.",
hlthcr,4. Healthcare Data and Privacy,Q-DAT-078,mc,Which of the following best describes the purpose of ICD codes in the healthcare system?,To calculate provider salaries based on patient volume,To provide a standardized way to classify diagnoses and inpatient procedures,To determine which patients qualify for health insurance,To rank hospitals by quality of care,,,B,ICD codes provide a standardized system for classifying medical diagnoses and inpatient procedures on claims and records.,
hlthcr,4. Healthcare Data and Privacy,Q-DAT-079,mc,Which scenario correctly applies the minimum necessary standard?,A billing clerk accesses only the diagnosis codes and procedure codes needed to process a claim,A receptionist reads a patient's full psychiatric notes to schedule an appointment,An IT technician reviews all patient records to test a new software feature,A hospital administrator shares complete patient files with a marketing agency,,,A,Accessing only the specific data elements needed for the task (billing) is a proper application of the minimum necessary standard.,
hlthcr,4. Healthcare Data and Privacy,Q-DAT-080,mc,Which of the following is a way that EHRs help reduce delays in patient treatment?,By requiring patients to carry paper copies of their records to every appointment,By making health information available electronically to authorized providers,By limiting the number of providers who can treat a patient,By replacing all diagnostic testing with automated algorithms,,,B,EHRs reduce treatment delays by making health information available electronically to authorized providers when and where it is needed.,
hlthcr,5. How It All Connects,Q-CRS-001,mc,What is the correct order of the basic healthcare claims process?,"Patient receives care, provider submits claim, payor processes payment","Payor submits claim, provider receives care, patient processes payment","Provider receives payment, patient submits claim, payor delivers care","Patient submits claim, payor delivers care, provider receives payment",,,A,The claims process flows from patient receiving care to the provider submitting a claim to the payor for processing and payment.,basic
hlthcr,5. How It All Connects,Q-CRS-002,mc,"After adjudication, which of the following is a possible outcome for a healthcare claim?",The claim is approved for payment,The claim is forwarded to the patient for self-processing,The claim is automatically resubmitted by the payor,The claim is sent to a different provider for review,,,A,"After adjudication, a claim may be approved for payment, rejected (returned for correction), or denied (service not covered or does not meet policy requirements).",basic
hlthcr,5. How It All Connects,Q-CRS-003,mc,What is the purpose of a HIPAA 270 transaction?,To submit a claim for payment,To verify a patient's insurance eligibility and benefits,To send payment from the payor to the provider,To report a HIPAA privacy violation,,,B,The HIPAA 270 transaction is an electronic eligibility inquiry that a provider sends to a health plan to verify a patient's coverage and benefits.,basic
hlthcr,5. How It All Connects,Q-CRS-004,mc,Every healthcare claim must pair which two types of codes?,A diagnosis code (ICD-10-CM) and a procedure code (CPT or HCPCS),A National Provider Identifier (NPI) and a Social Security Number,A facility code and a pharmacy code,A payor code and a clearinghouse code,,,A,Every claim must pair a diagnosis code (ICD-10-CM) explaining why care was needed with a procedure code (CPT or HCPCS) describing the service performed.,basic
hlthcr,5. How It All Connects,Q-CRS-005,mc,What is the difference between an Explanation of Benefits (EOB) and a bill?,An EOB is a summary of how the health plan processed the claim; it is not a bill,An EOB is the final bill the patient must pay to the health plan,An EOB and a bill are two names for the same document,"An EOB is sent by the provider, while a bill is sent by the payor",,,A,An EOB is a document sent by the health plan to the patient summarizing how the claim was processed. It is not a bill -- the patient should compare it to the actual bill from the provider.,basic
hlthcr,5. How It All Connects,Q-CRS-006,mc,What is an Electronic Remittance Advice (ERA)?,A document the payor sends to the patient explaining their benefits,"A HIPAA 835 transaction the payor sends to the provider detailing payment, adjustments, and denial reasons",A claim submission form the provider sends to the payor,An eligibility verification request sent before a patient visit,,,B,"The ERA (HIPAA 835 transaction) is sent by the payor to the provider after claim adjudication, detailing the payment amount, adjustments, and reasons for any denials.",basic
hlthcr,5. How It All Connects,Q-CRS-007,mc,What is the 'allowed amount' in healthcare reimbursement?,The total amount the patient must pay out of pocket,The maximum amount a health plan will pay for a covered service,The amount the provider charges before any insurance processing,The fee a clearinghouse charges to process a claim,,,B,"The allowed amount is the maximum a health plan will pay for a covered service. For in-network services, the provider generally cannot bill the patient beyond this amount.",basic
hlthcr,5. How It All Connects,Q-CRS-008,mc,What is the primary role of a healthcare clearinghouse?,To provide medical care directly to patients,"To receive transactions from providers, convert them to HIPAA-standard formats, and forward them to health plans",To issue National Provider Identifiers to new providers,To adjudicate claims and determine payment amounts,,,B,"A clearinghouse acts as an intermediary that receives claims and other transactions from providers, converts them into HIPAA-standard electronic formats, and forwards them to the appropriate health plan.",basic
